Tweet	Runnynose
サッカーの試合観戦のため、ネパールに行っている間中下痢に苦しんだ。	0
ゆとりのやつって、すぐ咳してごまかすよね。	0
咳を手でおさえるくらいのエチケットもないのかよ	0
まるで花粉症のように鼻水が止まらない。	1
咳がひどくて声が出ないよ	0
頭痛の対策ってあるのかね？	0
犬がでてくる物語が好きすぎて、どうしても感動してしまう。このシーンとか無理だ、鼻水がとまらないよ。	0
テストの日に風邪を引いた。最悪だー。	0
兄がインフルエンザの症状から回復した矢先に今度は私がインフルに感染してしまった。	0
鳥インフルエンザはずさんな管理でなるわけじゃないみたいだ。	0
昨晩からインフルエンザっぽい症状出てるんだよね。	0
鼻づまりが止まる気配なし！やばい。	1
東京では自動車やエアコンから排出される熱が暑さを助長している。	0
薬飲んだら鼻水鼻づまり、ピタッと止まった。	1
お風呂にはいったら頭痛が軽くなった。	0
携帯見てたんだけど、東京の神社では巫女さんのアルバイトを募集してるね。去年より少ないけど。熱が出ると応募できないから養生しなきゃね。	0
頭痛が酷いので帰らせていただきます。	0
痰に血が混じるのはやばいんだっけ？	0
鼻水止まらない！やばい！	1
痰が詰まって思ったのがうがいって本当に大事だ。	0
リンパ腫れて熱出てきた。明日仕事行けるか微妙だな。	0
寒気とだるさと頭ぼーっとする。風邪かなこりゃ・・・。	0
まさかの花粉症に、自分でも驚いてます。	1
ネパール料理を食べた後にしっかり手を洗わないと下痢になるらしいね。	0
インフルの検査しなきゃだー	0
花粉症に効果があると言うものは、全部試したけど。	1
頭痛がひどいとき、宇宙と交信できる気がする。	0
今日起きると下痢になっていた。やばい。	0
なんか鼻風邪っぽいけど今日のバイト休もうか迷う。	1
最近下痢っぽくてつらい。子供の頃を思い出した。	0
下痢とはちょっと違う症状なんだよな。	0
土産にインフル置いていくとか勘弁して。	0
今日の朝から鼻水止まらん	1
今年の風邪は熱が出るってニュースでやってたー。	0
鼻水が止まらない。頭がぼーっとして頭痛もしてきた。そんな時は風邪薬より頭痛薬のほうがなんか効くんだよね。	1
テレビのニュースで携帯が熱もってるとやばいって見た。	0
やばい、お腹が痛いと思ったら下痢だ。	0
風邪で体がだるくてぼーっとする。	0
兄がインフルエンザにかかってしまいました。	0
頭痛ひどすぎて帰りたい	0
最近軽い頭痛が慢性的に起こってる。	0
最近下痢ばかり続くのだけど、これはやばいよね？	0
中国で鳥インフルエンザが確認されたとさっきテレビで言ってたよ。	0
咳ぐらいで済んでるうちに対処するのが大事だよね	0
花粉症で微熱で、疲れる	1
鼻水とか鼻血とか他人の体液に触れるのは生理的に無理だな。	0
風邪が治らないので、明日のブログの更新は延期します。すみません！	0
一日中頭痛がひどくてきつい	0
鼻づまりとともに頭痛がきて学校休むわ	1
あの子の鼻づまりの声が大好きだ。	0
おたふく風邪って、風邪以上だよね？	0
鼻水、鼻づまりがやばい。薬を飲んでるのに鼻風邪には効かないらしく今日は休むことにした。	1
熱が下がらないから、今日行けるか微妙だ。	0
ブログに咳についてのエチケット記事を書いた。	0
熱が出た！やっぱり巫女さんのバイトの服装は涼しすぎたかな。	0
この季節、咳や痰には悩まされるよね。手洗い、うがいは大事だよ。	0
熱が高いから何かに感染したかなぁ	0
アトピーの療法は花粉症にも効果あるらしいよ	0
だるいし、頭痛だし、早く帰宅したい。	0
咳が出るならマスクするのがエチケットだろ	0
痰抑える薬がまずくて小一時間格闘してる・・・	0
本格的に風邪を引いたようなので、身体を休めます	0
少ない熱であれば問題ないという勝手な自己判断が正しいのか。	0
何時もお腹痛いってトイレに行ってるけど、下痢をしてるわけじゃないよ。	0
お風呂で温まると収まる頭痛と悪化する頭痛があるんだって。	0
熱もあるし鼻水も出るしお腹も微妙だ。	1
熱くらいで休むとみんなになんか言われるからなあ。	0
下痢で仕事に集中できない。	0
おたふく風邪って、感染力強い？	0
スペインでおたふく風邪が流行っているそうで、どうぞお大事に！	0
寒気するわ、風邪じゃないかな	0
これはまさか・・・花粉症というやつでは・・・	1
風邪でもおたふくでもどちらも大変だ！	0
熱に効く弁当のおかずって何だろう。	0
激しい頭痛だけど、医者に断られた	0
秋にも花粉症ってあるんだ。	0
なんか今日は風邪引いたのか、鼻づまりがすごい。	1
頭痛もするし、寒気もするし。どうやら風邪ひいたみたい。	0
朝から頭痛がやばいから風呂に入って寝る事にする。	0
インフルワクチン注射したのに	0
中国で鳥インフルエンザが流行ってるって本当かな？	0
だるいし頭痛がひどいしで早めに帰宅中。	0
最近仕事がきつい。夕方になると頭痛がするよ。	0
風邪ひいて頭が痛いから、どこかぼーっと出来るような休める場所があったらいいのに。あぁ、最悪だ。	0
秋だから花粉症の対策する人少なくない？	0
鈴木君からもらった解熱剤が効きすぎてすごい、風邪速攻でなおった	0
鳥インフルにインフルエンザのワクチンが有効か調べる。	0
風邪は病気に入らないらしい。大変だ。	0
誰かー、花粉症の良い療法知りませんかー？	1
熱がまだ下がらない。	0
秋の花粉症は少ないからあんまりわかってもらえなくてつらい。	1
犬が鼻水垂らしてるしゃしん送られてきた。	0
痰がでるときは特に手洗いとうがいをしようよ。	0
女性の咳っていろんなパターンあるよね。	0
インフルエンザって、かかっても手術とかすることはないよね？	0
インフルエンザっていつ回復すんの？	0
早くも花粉症に疲れている妻であった。	1
咳で腹筋が痛いってさ。相手するの疲れるわ	0
子供の頃の写真でてきたんだけど俺ほとんどの写真で鼻水たらしてる。どうなってんだ。	0
田中君が風邪をひいて何日も学校を休んでいる。普段病気に強い彼なのに珍しいな。	0
さっき頭痛がしたので帰ることにします。	0
おたふく風邪っぽい症状が出てるんですけど・・・・・・	0
鼻づまりだけでも解消したい。	1
マスクしてる人が多いけど、そろそろインフルエンザの季節か。	0
風邪とおたふくは全然違いますから！	0
またインフルの季節がきた	0
咳をしすぎると疲れるし、頭も痛くなってきたっぽいんだよね。全然治まらないし、最悪。	0
電車で隣に座ってる女性がずっと咳してる。マスクマスク	0
海外だとすぐ下痢するから、日本のありがたさが身にしみる。	0
朝から下痢でテンション下がるー。	0
下痢が止まらなかったあの日を思い出す	0
熱が出て無理して仕事行ったらひどくなった。病院行ったら来るのが遅いと怒られた。	0
彼が高熱でうなされて寝言と咳がすごい・・・	0
昨晩熱をはかったときは３６度だったが、今日はかったら３８度で、まだインフル治ってないっぽい。	0
生姜湯を飲んでいれば咳が止まるっぽい。	0
普通は咳するとき口を手で抑えるだろ？	0
空港から搬送された例の患者、デング熱に感染してたらしいよ。今朝、東京に帰って来たんだって。厚労省が発表してたの、テレビのニュースで見た！	0
痰が出なくなってきたから治ったっぽいぞ！	0
インフルかと思って病院行ったけど、検査したら違ったよ。	0
下痢の英単語の例文がおもしろすぎる！こんなの笑うわ！	0
秋にも花粉症があるらしい。	0
痰は道に吐いちゃダメだよ。それはエチケットだから。	0
寒気すると思ったら完全に風邪ひいたわ。	0
巫女さんを見るとテンションが上がりすぎて熱がでる。	0
花粉症で頭がぼんやりして疲れる。	1
花粉症対策しなければ！	1
ゆとりは咳するときのエチケットも知らないからゆとりだ	0
早く鼻づまり解消されないかな・・・。	1
アトピー患者って花粉症になりやすいの？	0
鼻風邪くらいなら薬で治るさ。	1
インフルエンザで昨晩は死ぬほど辛い思いをした。	0
風邪をひいたらしく寒気がするしだるい。	0
花粉症の対策に体を温めるのは有効らしいよ。	0
インフルエンザの季節だね	0
今日は朝から下痢がひどい。	0
大事なテスト前のこのタイミングで風邪とか。最悪だ。	0
感染症は熱を持ってるとさっきニュースで見た。	0
弁当の熱がだいぶありびっくりしたよ。	0
パソコンの使いすぎで頭痛が起きたから対策メガネを装着して見た。ましになるといいな	0
まさかの花粉症再発。	1
痰っぽいものが目から溢れ出す	0
花粉症対策にファスティングしてみよう。	1
小説を翻訳してたら頭痛してきた。	0
鳥インフルまたかよ。	0
下痢が酷いので今日仕事休みます。	0
鼻水が止まらない、今日の写真撮影は無理だ。	1
まとめブログで紹介されてた風邪に効果がある解熱剤買ったわ。最新科学の成果で開発されたらしい。	0
下痢をすると思い出すのは、紙がなかったトイレのこと。	0
ひどいときは熱が下がっても咳は一週間以上止まらないんだよね	0
風邪で眠いけどドリンク飲んだので完璧だ	0
アトピーや花粉症の患者には効果的だ。	0
熱はどの季節がいちばんつらい？	0
熱が出た。何かに感染したのか。	0
下痢がひどい・・・昨日食った海鮮丼があたったかも。	0
集団で下痢になったことを思い出す。怖い。	0
翻訳作業の進捗聞かれると頭痛がしてくる。相手は知ったこっちゃないだろうけど。	0
わざとらしい咳をしてるやつがいる。	0
家に帰ると、頭痛がする	0
今日の頭痛は本当にきついから薬が必要だ	0
風邪ひいたかな、鼻水が止まらない	1
おたふく風邪にかかっちゃった。	0
咳がひどい。手洗いうがいが大事だなあ。	0
部活の人インフルエンザ多すぎだよー	0
自分がまさか花粉症だとは思わなかったよ	1
風邪で頭がぼーっとしてる。休めるなら休みたいがこの時期休めず最悪だ。	0
わざとらしい咳をしている女性がいる。	0
宇宙の難しいことを考えると頭痛がしてきてまう。	0
頭痛に鼻風邪でだるい	1
ただの風邪なのに解熱剤までもらったんだが	0
寒いせいか下痢気味だ。仕事中に下さないことを祈るばかり。	0
帰宅したときから頭痛がやばい・・・	0
体だるい。バイトの面接前に風邪とは最悪だ。こりゃ参った。	0
高熱が出て咳が止まらない	0
朝起きたらお腹痛くて下ってる。下痢とかやばい。	0
私、おたふく風邪になったことがない！	0
鼻水出るけど熱は微妙だなぁ	1
あの人さ、痰が絡んだときわざとらしく咳払いするの本当にやめてほしいんだけど	0
花粉症対策ってあんまり効果ないみたいね。	0
咳が朝から出っぱなしで疲れるね。	0
痰が止まらないなあ。	0
だるいし風邪なんだけど休めない。	0
今日の満さん、鼻風邪やばくてつらそうだったね。あんな時くらい、休めばいいのに。	1
犬が大好きなんだけど、アレルギーで鼻水出ちゃうのよね。犬預かるの、嬉しいけど無理だー。	1
外出する時はインフルエンザの予防は忘れずに！	0
テレビで今年のインフルは熱があまり出ないって言ってるけど本当？	0
ひどい咳がずっと止まらなくて、昨日あたりから腹筋が痛い。	0
咳するときは手でおさえるのがエチケットでしょう。	0
熱だし鼻水だし。いきなりビックリして怖いわ	1
お腹が痛くて起きたら、下痢になっていた・・・。	0
昨日テレビでやってたガッテン流の花粉症療法って本当に効果あるんかね？	0
風で花粉が飛んでるから、花粉症が再発したわ。	1
誰かこの熱から助けてくれ。	0
咳を人に向けてやらないとか最低限のエチケットだろ。	0
花粉症に処方するめっちゃきく薬誰かつくってー！	1
鼻水が止まらないので熱でもあるのかと思ったけど、全然そんなことなかったわ。	1
痰に血が混じるのってヤバくない？	0
熱があるのに仕事に行かなきゃいけない社畜は辛い。取り敢えず今日を乗り越えたらゆっくり眠れるし、頑張ろう。	0
風邪でだるいし、今日行けるか微妙だな。	0
科学が良い薬を開発してくれたおかげで風邪をはじめとした病気が早く治るようになった。	0
最近、インフルが流行っているようだ。危機管理をしっかりしよう。	0
この季節はインフルの予防接種めんどうだけど行かなきゃ	0
いつの間にかインフルエンザが流行する季節になってしまった。すっかりワクチンを打つのを忘れてた。	0
熱だけど、特に問題なし	0
犬も鼻風邪ってひくのかな	0
英語で下痢って何だっけって帰国したばかりの祖母に聞いたらなぜか爆笑されたんだが。	0
風邪もりっぱな病気の１つ。	0
今年もインフルエンザが流行りだす前にワクチンを打とう。	0
病院で貰った花粉症処方箋効果ないんだけど	1
マスク装着、頭痛薬装備。	0
風邪は、すべての病気の原因です。	0
アトピーだと花粉症もつらいんだよー	1
インフルエンザにならないように体調管理しなきゃな。	0
最悪だー風邪ひいたー。頭がぼーっとする。	0
デング熱の感染についてテレビニュースで報道があった。	0
熱が出るのは生きてる証拠って誰か言ってた。	0
指数関数的に風邪患者が増えているらしい。	0
職場の女性がマスクもしないで咳ばかりしてる。怖いよ！	0
テレビでは感染しても熱はでないって言ってたけど。	0
くしゃみが止まらない。まさかこれが花粉症？	1
これ本当に花粉症に効果あんのかな。	1
花粉症で鼻水が止まらなくて鼻かみすぎて鼻が痛い。	1
なんかこれって風邪？鼻水と鼻づまりがやばいくらい止まらないんですけど。	1
最近、下痢ばっかで辛い。	0
咳が出る人はマスクするのがエチケットだよな。	0
今日下痢になって朝は何も食べられなくて、今お腹減りすぎてやばい。	0
微熱が出たから風邪かなって思ったら花粉症だった、花粉症でも熱出るって知らんかった	1
弁当を買ったら容器の熱が凄くてほっかほかにもほどがある。	0
やばい、頭痛がひどいから速攻寝る。	0
兄が部活でインフルうつされて爆笑！	0
ちょっと下痢気味だけど大丈夫だよね？	0
最近朝起きた時の頭痛が辛い。	0
まさか私も花粉症になっちゃった！？	1
咳くらいで休むのはゆとりだけだろ。どんなときでも仕事にでるのは大事だ。	0
頭痛ひどいし鼻水止まんないし今日は休むことにする。	1
兄がインフルエンザになった。	0
インフルで寝てたから背中が痛くてたまらん。だれかマッサージして。	0
直ぐに治る風邪薬、誰か開発して。	0
暑い季節になると、涼しい場所を求めて、どうしてもクーラーの設置してある部屋に行くんだけど、逆に冷房病になったりして、熱出しちゃダメだよね。	0
友達で一生懸命巫女のバイトしたら熱出した子いるんだけど、何か素質あるかもしれない	0
昨晩から、インフルエンザで高熱です。	0
頭痛で本当に仕事するのが苦痛じゃー。	0
最近微熱が続くからまさかと思ったら花粉症だった。	1
花粉症に効果があるという療法を試してみる。	1
檜の花粉症なめるなよ！	0
英語で下痢ってなんて言うんだろ	0
ちょっとお腹痛いとおもったら、やっぱり下痢になった。	0
咳のしすぎで腹筋が割れた。	0
病院でまさかの花粉症と告げられた！喉も痛むし、微熱も続くからただの風邪だと思っていたのに。まさか花粉症とは。	1
朝から頭痛がやばいので早く帰宅して風呂に入って寝る。	0
犬も鼻水たらすんだね。	0
花粉症に苦しんでるから、毎年対策を練りに練ってるんだけど今年も負け戦みたい。	1
頭痛の苦痛で休みが楽しめない。	0
頭痛がするからお風呂に入るのもだるい。	0
熱は下がったけど咳が止まらない。	0
嫁が熱出したんで、今日はコンビニ弁当	0
スペイン風邪とおたふくって、どっちもウイルスが原因らしい。特にスペイン風邪って、強い猛威を奮った病気らしいから、流行したら大変だろうな。	0
アトピーの人って花粉症もあるって人が多いらしいね。私は秋もつらいよ。	0
わざとらしい咳が得意である。	0
嫁は熱があるから弁当を作ってくれない。自分で作るのも微妙だから今日は外食にしようかな。	0
今年の新入社員がゆとりすぎるからか、咳しまくるのに何の対策もしてない。	0
薄着だから熱出すんだよと、センパイに着るようにと上着を渡された。優しいな。	0
頭痛対策、何かご存知でしたら教えて頂けないでしょうか。	0
甲高い音を聴くと頭に響いて頭痛が酷くなってくる。	0
ところで頭痛はまだきついですか、私さん？	0
今日インフルの手術じゃないただの注射なのにビビる	0
まさか自分が花粉症になるとは。鼻かみ過ぎて手が疲れる。	1
まさか、花粉症が再発？やだな。	1
頭痛の種は契約が更新してもらえるかどうかだな	0
インフルエンザワクチンって効果あるのかな・・・	0
インフル蔓延してて部活中止になった	0
風邪のやつの相手してたら、病気になった	0
今日、下痢で仕事にならない。	0
風邪でだるいけど仕事休めん。	0
咳がひどいので薬を飲む。	0
来春は花粉症患者が増えそうだ。	0
犬がぼくの鼻水を美味しそうに舐めます	1
犬と戯れていると鼻水が垂れてきた。	1
今年は早くも花粉症の症状が出始める。	1
朝起きるとやばいくらいの激しい頭痛がして、身体もだるい。こんなの久し振りだよ。	0
下痢という言葉をあまり使いたくない。	0
風呂に入ったら頭痛が大分良くなったなー。	0
英語って下痢ってなんて言うんだ？	0
最近色んな花粉症の治療法が出てきているが、本当に効果があるのだろうか。	0
あの女性の咳、いくらなんでもわざとらしいよね。	0
朝から頭痛で今日はもうだめです。	0
朝から激しい頭痛が止まらない。	0
お腹がちょっと痛いなと思っていたら、下痢した。	0
風邪といえば鼻づまりですよね。	0
蜂が花粉症だったら商売にならないね	0
鼻風邪を引いてしまった。	1
朝からちょっと下痢になっている。	0
下痢って、英語でなんだっけ	0
下痢って英語で何ていうんだっけ	0
インフルエンザで手術になることとかあるの？	0
中国で、鳥から新型のインフルエンザに感染して死んだ人が出てた筈だけれど、日本では検査キットとかちゃんとあるんだろうか？ニュースやってる割に管理の体制どうなってんのか全然わかんない。	0
鳥インフルエンザの検査って何分くらいかかるんだろ。	0
大変だ、この強い関節の痛みと怠さは尋常じゃないって言うもんだから、病院に付き添いで行ったらただの風邪だったらしい。君の気まずそうな顔見ると笑っちゃいそう。	0
そろそろインフルの季節だね。	0
花粉症対策に何がいいのか考えています。	0
体調が悪すぎて、咳が止まる気がしない。	0
咳・痰を抑える薬って何があるか知ってる？	0
東京のアスファルトから上がる熱は耐えられない。	0
テレビのニュースで、東京で熱が出る感染症がはやってるって言ってたけど誰かかかった人いる？	0
花粉症対策にメガネ買った。	1
妻が花粉症をこじらせて微熱	1
やっと鼻水止まって嬉しい。	0
風邪で頭ぼーっとする。	0
激しい頭痛のため早退して帰るわ。	0
犬も鼻風邪になっちゃうなんてびっくり！	0
久しぶりに東京に行って遊びすぎた。楽しかったけど鼻風邪ひいた。	1
祖母が作ったそぼろ丼のせいで下痢になってしまった。	0
高熱だし咳も出るし大変だぁ	0
花粉症のせいでずっと微熱でぼーっとしてる。眠い。	1
下痢になって去年ネパール行ったの思い出した	0
昨日学童の子供たちと戯れてたけど、鼻風邪の子が結構多かった。	1
インフルが回復してきてだいぶ元気になった！けどあと２日は外出禁止なんだよな。	0
花粉症だと思ってたら、微熱が出てきて風邪だと判明！間違えることもあるんですね。	1
ここまで花粉症の症状がヒドいのは久し振りだ。	1
頭痛以外はきついところはない。	0
この忙しい時期に風邪をひくなんて最悪だ！	0
娘が熱出して鼻水ズルズルだったから学校を休ませた、本人は謎の歌を歌っていて元気そう	1
頭痛対策誰か教えて！	0
鼻づまり解消方法、だれか教えて。	1
鼻づまりに苦しんでいる人にとって犬は癒される。	1
本格的な風邪をひいたみたい。最悪だ。	0
兄がインフルかかった、気をつけなきゃー。	0
熱があるので仕事は休む、絶対行かない	0
インフルエンザの季節だから、体調管理には気をつけないと。	0
熱もまだ残ってるし鼻水も出続ける。今日も仕事を休むしかないか。	1
携帯熱い、誰か助けて！	0
誰でも熱はつらいものです。	0
急募、頭痛に対する効果的な対策。	0
疲れた。花粉症もうやだ	1
中国でインフルが流行ってるみたい。	0
今月中に契約を取らなきゃいけない。ほんと頭痛の種だ。	0
仕事も失敗続きで、嫁ともケンカばかり。おまけに謎の熱がとまらない。	0
祖母の家で食べた丼が当たって下痢。	0
秋の花粉症のつらい。対策に時間が取られる	1
風邪薬飲んだけど咳止まらない。腹筋が痛い。	0
犬も鼻づまりになるのかな。	0
花粉症、マジ疲れる。鼻かみすぎて痛む。中国の黄砂も来てるんじゃねぇの？	1
下痢になったから薬使うか・・・	0
咳しすぎて、腹筋バキバキ。	0
風邪でだるいし頭ぼーっとする。これで明日学校休めるわ。	0
ツイッターだけでなくブログでも鼻水・鼻づまり情報発信中。	1
インフルエンザにかかってご飯作ることができない。	0
昨日から急に涼しくなったせいか、今少し熱あるかもも。季節の変わり目は体調崩しやすいよね。	0
早くも花粉症の症状が出てまいりました	1
鼻づまり解消のハウツー本を読んだけど、どれも胡散臭い。ネットのブログとかにも眉唾ものの民間療法がわんさかあるし、病院行ってちゃんと医師の診断を受けようかな？	1
風邪の解熱薬が新しく科学者たちに開発されたらしい。	0
謎の発熱。他は元気なんだけどな〜。病院いっといたほうがいいのかな。	0
最近ちょっとお腹痛い、下痢気味です。	0
三日くらい放置した肉丼食べたら下痢起こした	0
風邪は科学の力では治せないらしいから、強い体を作っておくのが大事だよ。	0
妻が微熱と花粉症でぐったり気味。	1
