Tweet	Runnynose
いま、インフルのワクチン打ってきた！	0
風邪最悪だけど、休める訳もない。	0
鼻づまりがようやく治ってきて嬉しい。	1
インフルエンザのときは外出をひかえなくちゃね。	0
来春は檜花粉が多いらしい。花粉症には辛いなー。	0
最近いつもお腹が痛い。下痢はしていないが仕事つらい。	0
インフルって悪化したら手術になるのかな？	0
テレビのニュースで高熱が出る感染症が流行っているとのこと。皆さん、気を付けようね。	0
うちの犬が鼻風邪ひいたのか、クシュンクシュン言ってる	0
翻訳作業が苦痛だぁ。頭痛がしてきた。	0
近所の奥様方の声がうるさすぎて、頭痛になって、この家きつすぎる。	0
英語で下痢って何ていうんだっけ。誰か言ってた気がするんだけど思い出せない。	0
インフルのワクチン打ったよ	0
今年は花粉症の対策をしないぞ	0
下痢だが体力をつけるために食う。	0
下痢のときは毒を体から出すと楽になる気がする。	0
昨晩からインフルで寝込んでる	0
まさか花粉症になるとは。	1
昨日から咳が止まらない。	0
帰宅してもまだ、頭痛がするんけど。	0
兄がインフルにかかった！家に受験生いるのにありえないんだけど！	0
毒でも入っていたのか。下痢と嘔吐がとまりません。	0
インフルが怖いから、ワクチン注射しに行く。	0
鼻づまりが止まるまで寝苦しいよ。	1
痰が切れないのかわざとらしく咳をしている。	0
咳がひど過ぎて腹筋やばい	0
頭痛がひどくて今は音楽聴くのもつらい	0
下痢が最近、やばい。	0
微熱が続くから病院行ったら、ただの花粉症しかないって言われた	1
熱を素早く下げる方法、朝のニュースでやってた！	0
咳をするときは手を押さえろよー。それくらい社会人としてのエチケットだろ！	0
鼻風邪くらいなら薬いらねー	1
花粉症対策にはマスクが一番です。	0
ぼーっとしています。だるくしています。寒気がしています。これって風邪？	0
咳するだけでも体力使うし、疲れる。	0
巫女さんのバイトやったら熱でちゃったし	0
ヘッドホンして曲聴いてたけどだんだん頭痛がしてきた。よく見たらフレームが微妙に曲がってて圧迫してたのかも。	0
ずっとお腹がいたいから下痢かもしれない。	0
頭痛がするのは宇宙からの電波を受信している証拠だよ。	0
久しぶりに家族で外出して海老フライ定食を食べた。とってもおいしかった！インフルになって寝込んでいた母もすっかり回復して本当に良かった。	0
そろそろ花粉症対策はじめなければ。	0
おたふく風邪って相当痛いらしいね。	0
集団で下痢になってしまうのが社会問題になっているらしい。	0
契約が必要と聞いて頭痛がしてきた	0
今日はインフルで休んでいる子が沢山いる。	0
頭痛のときに仕事をするのはきついから、早めに対策を取っておくことが必要だ。	0
鼻風邪引いた。家に引きこもって本読むわ。	1
起きるなり下痢、これってやばい？	0
花粉症対策にはヨーグルトがいいみたいだよー。	0
現代科学の叡智を結集しても未だに風邪を治す薬が開発できないのは納得がいかない！	0
仕事中に下痢になっちゃって、ちょっと、もう、早退したいで御座る。	0
軽い頭痛がする。風邪かもしれないから今日はもう寝る。	0
下痢でお腹壊したと学校に言おうかな。	0
いつもと違う食べ物を食べたら、下痢になった。	0
水の様な鼻水が止まらない。やばい学校休む。	1
最近、お腹の調子がちょっとやばい。今日も下痢で朝から具合が悪かったし。	0
鼻水がやばいったらない。薬飲めば止まるかな。	1
インフル薬飲んだら速攻回復した	0
携帯が熱を持ってて、やばい、誰か助けて	0
頭痛の症状軽いから大会出ようかな。	0
娘が熱出して、仕事に行けない	0
ネパールの激辛料理を食べるとその後はいつも下痢だよ。	0
おたふく風邪なら大変だ。	0
兄がインフルエンザ、爆笑	0
娘がまだ熱が下がらないので、会社休みます。	0
熱下がらない。弁当に鼻水たれた。後輩に見られた。最悪だ。	1
このタイミングで風邪とか最悪だろ	0
犬のブログを通じて知り合った人が鼻づまりで息ができず苦しいらしい。たかが鼻水だけの鼻風邪と侮れない。	0
風邪で頭がぼーっとする。	0
だるいし寒気がするし風邪っぽいー	0
インフルエンザだし、部活休むわ。	0
来春の花粉症は軽いといいなぁ。	0
マスクしないでゲホゲホするやつなんなん？咳エチケット守れや。	0
風邪だと思ってたんだけどずっと治らないしなんか病気なのかもしれん。	0
咳が止まらなくて腹筋が痛い	0
花粉症患者にはつらい季節がやって参りました	0
最近お店の仕事が忙しくて疲れる毎日だ。疲れると花粉症の症状もひどくなる。そして遂に妻も花粉症が発症した。	1
風邪っぽいと思い込んでると本格的に風邪ひいた	0
頭痛対策として好きな音楽を聴くこともある。	0
集団で下痢だってさ、怖いわ	0
鼻づまりで頭痛までしてきた感じだ	1
熱もあるし鼻水も出るしつらい。	1
来春の花粉症はあまりひどくないらしい。	0
感染して熱が出るケースは少なくないらしい。	0
くしゃみが止まらない、まさか花粉症かも	1
たばこ吸い過ぎて、痰がひどい	0
あー昨晩から体調悪いと思ってたらインフルだった、、	0
犬が鼻水垂らしている写真が大好きだ	0
なんかがんばったら鼻づまり止んだ。	0
背中がぞくぞくする、インフルエンザかな。	0
熱は出てるけどお腹に来る風邪じゃなさそう。	0
鼻づまりがひどいけど、私は頑張ってブログを書くよ。	1
鼻づまりが解消して嬉しいわ	0
お腹痛くて下痢で仕事遅刻	0
鼻づまりがひどくて頭痛もしてきた	1
頭痛がやばいから帰宅して寝るー	0
鼻水、鼻詰まりを含む典型的な鼻風邪になったので今日の面接は無理だ。	1
高熱が出て仕事中、鼻水が止まらなくて焦った。	1
テレビでやってたけど、感染してしばらく時間が経ってから熱が出るらしい。	0
この微熱が続いて疲れる感じ、まさかの花粉症か？	1
咳を抑える薬を飲んだら眠れた。	0
今日は何度も下痢がでちゃった。	0
花粉症に加えて公害のせいで鼻水が滝のようだ	1
鼻風邪、やばい。早く薬のんで休む。	1
ゆとり世代は咳が出るやら痰が切れないだですぐ会社を休む。	0
集団食中毒にまきこまれて下痢を起こしている	0
花粉症だと思っていたのにまさかの微熱。風邪かもしれない。	1
スペイン風邪ってのが昔流行った。	0
鼻づまりが止まるテープ買わないと	1
テレビのニュースで熱が出てる子は少ないって言ってた。	0
インフルに罹ったせいで学校に行かなくていいのはいいけれど、部活にも出られないのが辛いな。	0
ここまでひどい頭痛は久し振りだなぁ。	0
ただの風邪かと思っていたらおたふくだった！	0
朝起きたら下痢だったつらい。	0
朝起きるとお腹痛くてトイレ行ったら下痢だった	0
最悪だ！だるいし寒気するし風邪引いたっぽい。	0
娘が熱出して、見事私ももらってしまいました。	0
娘が熱出したので早退。	0
こんな激しい頭痛は久し振りだぜ	0
咳がひどいな風邪っぽい。	0
来春は花粉が少ないみたいだから、花粉症の患者さんは助かるね。	0
インフルに感染したっぽい、熱下がらない	0
咳が出たときは肋骨の辺りをマッサージすると止まる。	0
インフルエンザかもしれないから部活休もうかな。	0
頭痛がするし熱っぽいしだるいし風邪をひいたらしい。	0
熱っぽいのに誰か来ちゃうし。	0
鼻づまり解消には鼻洗浄が効くらしいけど、試す勇気がない。	1
まさか自分が花粉症になるなんて・・・！	1
風邪のときは科学的に寝れば良いと証明されている。	0
クラシック聴くと頭痛する、苦痛以外のなにものでもない	0
鼻づまりが解消できるグッズがあればいくらでも出す。	1
仕事中もずっと下痢で、ちょっとのつもりが十分以上もトイレに篭っちゃったし。	0
咳き込み過ぎて腹筋痛い。	0
職場でちらほら病欠の人が出てきてインフルの季節を感じる。	0
頭痛は何か対策ができるんですか？	0
熱が４０度まであがってきた。今思うとどこで感染したんだろう？	0
花粉症の人とアトピーの人ってどっちの患者が少ないのかな？	0
熱が下がったので巫女のバイトをしに東京へ行こう。	0
朝から猛烈に腹が痛かったけど、案の定下痢だった。	0
やばい今日風邪引いたかも、鼻水止まらない。	1
季節外れのインフルエンザに感染していま高熱出てます。	0
月曜は何時も下痢だわ	0
ネパールに旅行に行った時、水が合わなかったのか一晩下痢が続いて大変だった。	0
咳で腹筋つりそう、、	0
インフルエンザから回復したので外出した。	0
兄が昨晩手術だったのに、インフルで外出できなかったから、手土産の一つも持っていけなかったよ。	0
熱があるので布団に潜ってずっと携帯みてる。飽きてきた。	0
夜中に起きたのは下痢のせい	0
鼻づまりひどくて薬飲んだら喉が乾きすぎる。	1
下痢で辛い思いしたことを思い出すよ。	0
こんなに激しい頭痛は久し振りだ。早く帰りたい。	0
本格的な風邪のせいで、いつもは完璧だと言われる仕事が今一だと言われる始末で最悪だよ。	0
咳を抑えるのは手洗いが一番だわ	0
英語で下痢ってなんていうのだ？	0
わざとらしい咳ってリアルで見るとむかつくよね	0
ネパールに旅行行ったら下痢になっちまったー	0
なんか鼻風邪ひいたっぽい	1
わざとらしい咳をして笑いそうになるのをごまかすとか、漫画だけの話だと思ってた	0
咳が出るときはエチケットを守ってほしいよね。	0
鳥インフルエンザのニュースを見た。感染した疑いがあるアヒルやニワトリ３２万羽を処分したとのこと。危機管理しっかりしているよね。	0
熱はあるけど問題ない。今日の飲み会は絶対行くんだ。	0
インフル治りかけだからまだ外出できないな。	0
わざとらしい咳がうるさい	0
まさか、この俺が花粉症になるなんて・・・。	1
最近疲れると咳がとまらないし、胸も痛い。大丈夫かな？	0
甲高い女性の声を聴くだけで、頭痛が酷くなる。頼むから声落としてくれないかな。	0
サッカーの決勝戦前に下痢になったとか笑うしかない	0
花粉症つらい。檜なんて絶滅すればいいのに・・・	1
ところで音楽を聴くと頭痛がひどくなる。	0
君がスペイン行ってる間、俺は風邪ひいてたけどな！	0
スマホケースが熱で溶けた・・・	0
わざとらしい咳をする上司って最悪。	0
インフルにかかった奴にお土産渡す	0
問題は、巫女さんが熱でたらしく、そこにいないってことなんだよなあ	0
花粉症再発、こんなつらいの久し振りだ	1
大人になっておたふく風邪やって死にかけました	0
朝やばい頭痛に襲われてから体がだるくてしょうがない	0
花粉症が再発してつらいよ	1
娘がずっと鼻水出してる。熱はないんだけどなー。	1
兄がインフルエンザにかかった！みんなも気を付けて！	0
風邪で薬のんだけど、なんか鼻水だけ止まらない。	1
ソロソロ頭痛さんは帰宅する時間でないか？	0
保育園での集団生活。今は下痢が流行中。	0
風邪を治す薬って開発されているのかな？	0
朝下痢止まらなくて仕事行けないかと思った	0
咳するだけでも疲れる体力のなさ	0
まとめブログ読んでたけど、犬も鼻風邪引くんだな。写真載ってた。	0
妻の鼻水がひどかったから風邪かと思って病院に行かせたら、花粉症だったらしい。	1
風邪でだるいしぼーっとするし最悪	0
秋でも花粉症の患者さんはいるみたいだし	0
頭痛だが強力な薬を飲みマスクもきつく装着完了し俺はデート行きます。	0
スペイン風邪とおたふく風邪の違いを教えてくれ	0
花粉症治ったかと思ってたけど今年から再発したみたい	1
激しい運動をしたからか、頭痛もあるし体もだるいし、今日はお風呂入らないで寝る。	0
ネパール人て下痢なる？	0
海外で下痢になって、でも英語が話せなくて詰んだことがある。	0
リンパマッサージ行ったら熱出てきた	0
風邪って病気に入らないよね。	0
３歳の娘が風邪だが、おたふくじゃないかと不安。	0
起朝ごはん食べてからお腹の具合がやばい。下痢かも	0
こんなに遅い時間なのに、地面が熱を持っている。	0
インフルエンザの検査に行く。	0
ニュースで見たデング熱、怖すぎる	0
妻が花粉症で毎年春は大変だなあと思って見ています。	1
娘の熱と鼻水がひどい	1
旅行に行ったら、土産にインフルもらってきた。	0
今年も鳥インフルエンザがあったのか。	0
頭痛は久しぶりだ。さっさと帰る。	0
咳がやっと止まってきたよー。よかった	0
鼻水が少し垂れてきただけで会社を休む、俺の妻。	1
インフルエンザだよ、いやな季節だね	0
スペイン風邪調べたけどやばいな	0
この熱って感染と関係ないといいけど。	0
爆笑したら危うく下痢が出るところだった。危なかった。	0
頭痛で体全体がとてもだるい。	0
嫁が熱出して寝込んでるから、弁当でも買って帰ってやるかな。	0
眠くてだるくて参った。風邪だ、最悪だ。頭痛っぽい。	0
朝起きると下痢がひどくて会社休んだ。	0
頭痛が治らないのは苦痛でしかない。原因が分からないから対策もできなくて辛い。	0
花粉症って秋の方がつらい気がする。	0
咳を抑える薬買わなきゃ。	0
鼻水が本を読み始めると垂れて来るんだよね。	1
風邪ひいちゃったから、行けるかどうか微妙だな。	0
インフルの奴って沢山居るよな	0
嫁の熱が移って仲良く休むことに、とほほ。	0
リンパが腫れて高熱出た	0
仕事中に下痢になるのだけは勘弁。	0
来春を見通して花粉症対策のアイテムを買った。	0
スペイン風邪って１億人くらい死んだらしいね、すごい。	0
花粉症、今年は万全の対策する。	0
鼻づまり解消には我が家の犬と戯れるといいよ。	1
遂に花粉症になってしまった。	1
無事インフルから回復しました。	0
咳で胸ヒューヒュー言ってるわ	0
周りに咳してる人が多いときはいつも以上に手洗いを徹底しないと。	0
昨日も下痢、今日も下痢、何時も下痢	0
あまりにも咳がひどくてわざとらしい咳だと言われたがこちらは高熱で大変なのです。	0
わざとらしい咳をするなよ	0
スペイン風邪って大変みたい、誰かのブログで読んだ。	0
インフルになってしまった、体調管理大事。	0
そろそろ起きる時間だ。寒いから布団から出たくないし下痢とか最悪。	0
なんか鼻づまりで、息が苦しい。	1
咳がいつ止まるのか不安。	0
頭痛がひどくなってきたからとっとと帰るに尽きる	0
なんか今日の給食変な味がしたので集団で下痢とかなったら怖いよー。誰か助けて。	0
花粉症対策で訪れる患者の数が増えている。	0
インフルエンザのかかりやすさって性によってちがうのかな。うちでは女性陣だけ罹患した。	0
こんなに激しい頭痛久し振りだぜ	0
咳しすぎて腹筋痛いし、ちょい血痰が混じるようになったしそろそろ俺やばい。	0
ところで頭痛はおさまったの？	0
下痢やばい学校間に合わん	0
咳がひどい上に痰が混じってきた、明日病院行かなきゃ	0
鼻づまり解消法をだれか教えて！	1
旅先で祖母に下痢の症状があり、薬局で英語が通じなかったのもいい思い出だ。	0
インフルにかかった。爆笑。	0
鼻づまり解消ブログ書いたから読んでくれると嬉しい	0
わざとらしい咳しやがって。	0
鼻づまりで今日は休むわー	1
今日は下痢で何も食えないし寒いしやばい。	0
どんなに科学が発達しても風邪や病気はなくならないだろう。	0
弟は、鼻水に熱。嫁は熱とお腹くだし。最悪だ！	1
来春の花粉症少ない見通しだって！助かる！	0
ネパールの旅行中に生水を飲んだら下痢をした。	0
咳がひどいので疲れる。	0
とてつもない腹痛で朝起きる時は大体下痢なんだよね	0
咳をしすぎて腹筋が痛い。まったく治まる気配がないからそろそろ病院に行かないとやばいかも。	0
熱が下がっても登園できないときはテレビばかり見せてしまう。	0
ブログには高熱が出て痰も出ると書いていた。	0
最悪だ・・・。絶対コレ風邪だ。	0
毎年インフルの予防ワクチンの接種受ける気がしない	0
鼻風邪は犬も食わないってさ。	1
風邪つらい。熱が上がってきてるよ。解熱剤が欲しい。	0
咳がでるときはマスクをするのがエチケットだよね。	0
咳が止まらないので、手洗いをわざとらしいくらいにやってみた。	0
激しい頭痛がする。こんなの久し振りだ。	0
鼻風邪に加えて頭痛も酷くなってきたし、いよいよ限界の感じがある。	1
朝から問題発生しています。娘が熱あるけどまだあきらめないよ、お母さんは。	0
手洗いうがいで咳をしないようにしよ！	0
やっと鼻水止まるわ。	1
君の風邪には、昆布茶をどうぞ！	0
痰と血が混じっていて、もうダメかもしれない	0
花粉症に効果のあるお茶もらったよ。	1
咳、のど、風邪に症状！そして、高熱	0
まさか妻の花粉症が再発するとは！	1
花粉症からまさかの微熱。	1
花粉症は久し振りだって、ホントかなー	1
最近よくお腹が痛いよ。下痢とまらないし。	0
花粉症対策、マスクと眼鏡だけは必ずやってる。	1
今日も今日とて下痢で御座います	0
季節の変わり目は毎年熱出してる気がする。	0
花粉症対策をそろそろ始めるぜよ。	0
風邪くらいで休めると思うなよ	0
うちのクラス、集団で下痢事件	0
咳がひどいと腹筋が痛くなるし疲れる。	0
携帯が熱をもっている。熱いよ。	0
昨晩ついにインフル発症してしまった。	0
咳にはマスクがエチケット。	0
隣に住むゆとり世代の女性が、ブログに咳をして高熱でうなされてる写真を投稿してるよ。	0
朝から頭痛でやばい。	0
最悪だ。これから大切な会議なのに、風邪引いて頭がぼーっとする。	0
兄がやっとインフルから回復した。	0
さっき帰ってから頭痛が。風呂に入るのもだるい。	0
皆の花粉症対策教えてください。	0
下痢で腹痛くて起きちった	0
ちょっと、ちょっと、ちょっと。やばい、下痢？	0
どうやら鳥インフルエンザが流行っているらしい。	0
痰がひどいので、薬を飲んだよ。	0
本格的に風邪をひいたらしく、完璧に参ってしまった。	0
犬でも鼻風邪ってなるのかな。	0
朝寒いからかなあ、やばい、下痢した。	0
きつい装着で頭痛がしてきた。	0
僕はいつも咳の症状が出てから高熱が出る	0
下痢かも、なにが毒のもの食べたかなぁ。	0
来春こそ花粉症に効果がある療法を見つけたいよ。	0
風邪ひいて鼻水が止まるよう薬飲んだよ。	1
頭痛でだるいからもうやだよー。	0
インフルのワクチンが不足してるって	0
下痢で小学生の頃を思い出す	0
まさか花粉症になるとは思わなかった。	1
昨晩インフルにかかったかとおもった。	0
犬と戯れてたら鼻水が出てきたぜ	1
やばい。いま仕事中なのに下痢で漏れそう。	0
高熱でもよく眠れる薬って何？	0
寒いせいか朝から下痢がやばい！	0
今回風邪ひいたのは家族の中で私が最初だった。	0
やばい、鼻水が止まらない。	1
風邪で頭がぼーっとしてきた。	0
来春の飛散量はすごいので、花粉症の俺には大変だ。	0
まるで花粉症のときのように鼻水が止まらない。	1
今日も下痢で御座る。会社行きたくない。	0
インフルのワクチンまだ打ってないわ、どうしよう	0
まさか花粉症になった？つらい	1
昔、ひどい下痢になった事を思い出した	0
インフルエンザのワクチンって性機能強化にもつながるらしい・・・	0
インフル流行ってる季節になったねぇ	0
英語で下痢ってなんていうの？	0
花粉症のせいで常にしんどい。ぼーっとして先輩の名前を間違えるという失態を犯してしまった。	1
知ってる人少ないかもだけど、秋にも花粉症あるから！	0
インフルっぽい症状だから検査したらばっちりインフルだった。	0
宇宙について考えると頭痛がする	0
下痢に負けずサッカーをした。	0
咳も痰もひどいし、熱っぽいし、体調も微妙だ。	0
花粉症対策でめがねをかけよ	1
鼻水が止まる薬がほしい。	1
兄ちゃんのせいでインフルうつった。	0
なんかインフル流行ってるけど、鳥も季節で流行るのかな？まだワクチンできてないから殺処分？もう結構話題になってから経ってるのに、めっちゃ御粗末だよねー。	0
集団食中毒で下痢になったー。	0
まさか中国で花粉症になるとは思わなかったな。	0
熱が出て首の辺りが腫れてる。	0
兄と同じ部活が一緒の人が昨晩からインフルになってしまったらしい。	0
まさか私も花粉症デビュー・・・	1
頭も痛いし痰もひどい。完全に風邪だ。	0
花粉症で目と喉が痛む	1
来春は花粉症デビューの予感	0
リンパが腫れているなと思っていたら、熱が出てきた。	0
インフルエンザになって外出できません！	0
朝眠いし起きれない時に、体温計擦って熱あることにすれば風邪って思われて絶対休めるしバレないし完璧だわ。	0
今日で一週間、まだ熱が下がらないんだけど。	0
うちで働いてる女性が、高熱で休むとわざとらしい咳をしながら電話してきたんだけどブログで遊園地に行ってるって書いてて笑った。	0
咳が治まるよう薬を飲んだよー、治ればいいな。	0
この時期に風邪にかかるなんて最悪だ	0
おたふく風邪って大変なの？大人がかかった場合。どうぞどなたか教えてください。	0
今朝起きたら下痢で、ホントやばい。お腹、痛い。寒い。	0
インフルエンザの多さに危機感を感じます。	0
頭痛が苦痛、無痛はいつ？	0
頭痛対策の薬もらったけど全然効かない。	0
頭痛がひどくてまじ授業が苦痛だよ	0
熱が出て、こりゃインフル感染か。	0
握手した人がインフルになったんだけど、移るのかな？	0
長風呂したら頭痛なおった！リラックス大事だな〜	0
最近急に東京涼しくなったからか、風邪ひいて熱。	0
風邪を引いたのは今年最初だ。強い解熱ができる薬ないかなぁ。	0
昨日から頭痛が酷くなってきている。早退して今夜は早めに寝るか。	0
風邪で鼻づまりがひどい。	1
頭痛には対策が必要だ！	0
東京には熱がこもりやすいから節電しちゃだめ！	0
弟は熱がありリンパも腫れるしお腹も痛いらしい。	0
熱があるから涼しいとこに行きたいー	0
風邪で頭がぼーっとしてる。だるい！	0
だるいし熱っぽいし風邪だから忘年会欠席しようとしたら無理やり出席させられた。	0
